,Title,Published_date,Views,Likes,Comments,Month
427,10 SIMPLE Weight Loss Tips and Fitness Advice | BeerBiceps Fat Burning,2017-11-30,247804,6863,333,Nov
428,6 Secret Study Tips For Good Marks In Exams | BeerBiceps,2017-11-27,661007,36433,1315,Nov
429,Fitness QnA - Jo Chahiye Puch Lo | BeerBiceps Livestream 17,2017-11-23,39736,3165,246,Nov
430,12 Winter Clothing Tips For INDIAN MEN | Men's Style India | BeerBiceps Men's Fashion,2017-11-20,738798,22730,1028,Nov
431,TOP 10 Fitness Tips For TEENS - Build Muscle + Get Taller | BeerBiceps Teenage Fitness,2017-11-16,474939,21236,618,Nov
432,True Story of BeerBiceps - 6 Rules Behind Making Money | BeerBiceps Motivational Startup Story,2017-11-13,450685,37493,1581,Nov
433,How To Increase Height & Stay Fit | Ultimate Teenage Fitness & Height Growth Guide | BeerBiceps,2017-11-09,2331634,94784,5039,Nov
434,Top 5 Winter Hair Care Tips For Men | Men's Hair Care Routine | BeerBiceps Grooming,2017-11-06,3103315,74579,2518,Nov
435,ULTIMATE Bench Press Tutorial | How To Bench Press Correctly | BeerBiceps Workout Coaching,2017-11-02,47641,1957,113,Nov
436,South Mumbai Shopping Vlog - Palladium Mall Men's Fashion Haul | BeerBiceps Vlog 6,2017-10-30,493502,12963,578,Oct
437,Warrior - In Support Of The MeToo Movement | BeerBiceps,2017-10-26,90870,4848,261,Oct
438,How Video Games Earned Him 100 MILLION DOLLARS - The Vishal Gondal Startup Story | The Ranveer Show,2017-10-23,121695,6003,282,Oct
439,ULTIMATE Squats Tutorial | How To Squat For BEGINNERS | BeerBiceps Workout Coaching,2017-10-19,51048,1867,122,Oct
440,How To Style Men's Traditional Wear | Diwali Special | BeerBiceps Fashion,2017-10-16,597961,14489,682,Oct
441,Office Mein QnA | BeerBiceps Livestream 16,2017-10-16,32753,1820,88,Oct
442,INSANE SCIENCE Behind FATS - How Much Fat Should YOU Consume Everyday? BeerBiceps Diet,2017-10-12,65733,2945,210,Oct
443,"ROME Travel Vlog - Food, Art, Fashion, Architecture, Culture | BeerBiceps Vlog  5",2017-10-09,67469,2442,156,Oct
444,ULTIMATE Deadlift Tutorial | How To Deadlift With CORRECT FORM | BeerBiceps Workout Coaching,2017-10-05,123417,4114,204,Oct
445,Why I Am ALWAYS HAPPY - 500K Subscribers Special | BeerBiceps Motivation,2017-10-02,87011,4022,228,Oct
446,Cost Of Healthy Dieting - How Much I Spend Per Day On My Diet | BeerBiceps Fitness,2017-09-28,431280,12025,503,Sep
447,How To Dress Well For Indian Men - Part 2 | BeerBiceps Fashion,2017-09-25,3821487,92359,1769,Sep
448,Need Your Support | BeerBiceps,2017-09-07,68657,5395,495,Sep
449,Best Bloopers Ever | BeerBiceps Bloopers,2017-09-04,841446,57283,2939,Sep
450,Arm Workout AT HOME For Men & Women | Exercise Form & Training Plan | BeerBiceps Home Workout Series,2017-08-31,159664,4882,165,Aug
451,Fashion & Grooming QnA | BeerBiceps Livestream 15,2017-08-28,35868,1889,149,Aug
452,"GOODBYE FOREVER - Stretch Marks | Stretch Marks Science, Causes & Treatment | BeerBiceps",2017-08-24,2172390,65038,2130,Aug
453,How To Achieve ANYTHING IN THE WORLD | Advanced Meditation Technique | BeerBiceps Motivation,2017-08-21,865028,40321,986,Aug
454,Leg Workout For Men & Women At Home | Exercise Form & Training Plan | BeerBiceps Home Workout Series,2017-08-17,133885,4543,147,Aug
455,Ultimate Shoe Collection For Indian Men | Men's Essential Shoes | BeerBiceps Fashion,2017-08-14,975535,22512,1088,Aug
456,Paneer - The Best Vegetarian Protein Source | BeerBiceps Fitness,2017-08-10,682517,19898,1008,Aug
457,TINDER GUIDE - Ultimate Tips | Tinder Do's & Dont's | BeerBiceps Dating Advice,2017-08-08,1587501,31213,1652,Aug
458,BACK WORKOUT For MEN & WOMEN - Home Workout Series | Exercise FORM & Training Plan | BeerBiceps,2017-08-03,127169,3221,151,Aug
459,Best Shaving Guide For Men | BeerBiceps Grooming,2017-07-31,553798,14161,554,Jul
460,Say BYE To MAN BOOBS | How To Remove Chest Fat & Puffy Nipples | Gynecomastia Explained | BeerBiceps,2017-07-27,3192435,65233,1779,Jul
461,College Dressing Style For Indian TEENS & MEN | BeerBiceps Fashion,2017-07-24,1743706,51044,1696,Jul
462,CHEST Workout For Men & Women | Beginners Chest Exercises Without Equipment | BeerBiceps,2017-07-20,214141,6581,184,Jul
463,SECRETS BEHIND SUCCESS - Entrepreneur's Morning Routine For MAXIMUM WORK EFFICIENCY | BeerBiceps,2017-07-16,921548,41028,1243,Jul
464,Easy And Simple Tips To Gain Weight Faster | BeerBiceps Fitness,2017-07-13,617769,21452,602,Jul
465,Extended Live Stream - Chetan Chotia | BeerBiceps Livestream 14,2017-07-10,26643,1535,116,Jul
466,How To Lose Weight FAST At Home - Without Exercise | BeerBiceps Weight Loss Diet Advice,2017-07-05,4135552,104959,2605,Jul
467,10 LOW BUDGET Fashion Tricks | How To Save MONEY On Clothes & Still Be STYLISH | BeerBiceps,2017-07-03,1386204,32847,1163,Jul
468,Guided Home Workout for Men and Women | BeerBiceps Fitness,2017-06-29,794509,31934,829,Jun
469,Fashion QnA | BeerBiceps Livestream 13,2017-06-27,19709,1396,99,Jun
470,Top 7 Tips To Look Handsome Instantly | Indian Men's Grooming Explained | BeerBiceps Men's Grooming,2017-06-26,5183982,92086,2906,Jun
471,3 DAY Working Professional Gym Exercise Plan | BeerBiceps Push Pull Legs Training Split,2017-06-22,91035,2943,170,Jun
472,10 Ways To Impress Any Girl - MostlySane | BeerBiceps Romance,2017-06-19,1082877,35525,1093,Jun
473,How To Make A Career In Fitness - Abhinav Mahajan | Indian Fitness Industry | The Ranveer Show,2017-06-15,204339,9034,265,Jun
474,BeerBiceps & Abhinav Mahajan Enjoy Unhealthy Food | BeerBiceps Livestream 12,2017-06-13,73921,3011,100,Jun
475,Best Home Workout Routine | BeerBiceps Fitness,2017-06-07,579723,17782,530,Jun
476,9 Tips To Look Fit Without Exercise | BeerBiceps Fashion,2017-06-05,945594,31374,642,Jun
477,Facts Indian Parents Should Know About Protein Supplements | BeerBiceps Fitness,2017-05-31,822851,35433,1531,May
478,How To Match Colours Of Clothes | How To Dress Well & Be The Sexiest | BeerBiceps Fashion,2017-05-29,2122389,75792,1612,May
479,250K Subscribers Special - Message to All | BeerBiceps,2017-05-28,20644,1367,181,May
480,Ramzan WEIGHT LOSS Diet Plan - FREE OF COST & GUARANTEED TO WORK | BeerBiceps,2017-05-25,83096,3176,282,May
481,Quitting Coffee WILL Change Your Life | How And Why To Quit A Coffee Addiction | BeerBiceps,2017-05-21,214005,7537,729,May
482,COFFEE 101 - Everything You Need To Know | Coffee & Caffeine Side Effects | BeerBiceps,2017-05-18,161109,9442,607,May
483,Important Announcements - Future | BeerBiceps Livestream 11,2017-05-16,16450,922,55,May
484,Yoga For BEGINNERS - Natasha Noel | BeerBiceps Yoga | The Ranveer Show,2017-05-13,173456,3547,142,May
485,Are Peanuts Good For Weight Loss? | BeerBiceps Fitness,2017-05-10,292402,14728,429,May
486,Jo Puchna Hai Puch Lo 😘🙏 | BeerBiceps Livestream 10,2017-05-09,18397,1291,77,May
487,From Bodybuilding To Bollywood | The Inspiring Sahil Khan Story | The Ranveer Show,2017-05-07,1443010,48594,828,May
488,Scivation Xtend BCAA - HONEST Product Review | BeerBiceps Supplement Review,2017-05-04,162875,2185,191,May
489,How to Dress Well For Indian Men |  BeerBiceps Fashion,2017-05-02,7882666,163493,3483,May
490,45 Kg. WEIGHT LOSS Story | Fat to Fit Transformation Story - Reshma Badi | The Ranveer Show,2017-04-29,354891,6137,240,Apr
491,FREE Intermittent Fasting DIET PLAN for Fat Loss OR Muscle Gain | BeerBiceps IF Diet,2017-04-27,1368851,36621,1307,Apr
492,BeerBiceps Team | BeerBiceps Livestream 9,2017-04-25,28853,2251,76,Apr
493,What Are The Symptoms & Cure for Hypothyroidism | BeerBiceps,2017-04-23,613222,21110,1014,Apr
494,A Complete Intermittent Fasting Guidebook With Benefits | IF Diet Explained | BeerBiceps,2017-04-20,1823214,98469,3252,Apr
495,How To Start A Startup - Ranveer's LifeHacks | BeerBiceps,2017-04-17,49034,3718,82,Apr
496,Will Your Height Stop Increasing If You Weight Life? | BeerBiceps Fitness,2017-04-16,504300,24256,1159,Apr
497,Top 5 VEGETARIAN Weight Loss Foods In INDIA | BeerBiceps Veg Weight Loss Diet,2017-04-13,172023,5489,216,Apr
498,Ask Me ANYTHING - But Preferably Not Fitness | BeerBiceps Livestream 8,2017-04-11,19913,2010,109,Apr
499,Best Fat To Fit Transformation Story - Mansoor Fallah | The Ranveer Show,2017-04-09,617751,11763,532,Apr
500,Why India HAS NOT Produced FAST BOWLERS | BeerBiceps Sports Science Cricket,2017-04-05,192839,6158,617,Apr
501,5 Tips For SUCCESS In Life - Ranveer's LifeHacks | BeerBiceps,2017-04-03,39606,2042,102,Apr
502,FREE POST KETO Diet & Training Plan - What To Do AFTER Keto? | BeerBiceps Ketogenic Diet,2017-04-01,143305,3988,243,Apr
503,"YTFF 2017 - Fitness Regimes of YouTubers? AIB, Kenny Sebastian, MostlySane, BeingIndian | BeerBiceps",2017-03-30,86910,2635,102,Mar
504,India's BEST Fitness Trainer - Binny Sreedharan | The Ranveer Show,2017-03-25,43778,1093,69,Mar
505,VEGETARIAN Bodybuilding Diet Science | BeerBiceps Veg Muscle,2017-03-22,94251,3237,148,Mar
506,BIGGEST MISTAKE You'll EVER Make In Life - Ranveer's LifeHacks | BeerBiceps,2017-03-20,281619,10065,329,Mar
507,Fitness Motivation India | BeerBiceps Motivational,2017-03-19,26582,1073,92,Mar
508,The GM DIET - Pros and Cons | BeerBiceps Weight Loss,2017-03-16,160832,2422,402,Mar
509,LifeHacks | BeerBiceps Livestream 6,2017-03-14,7473,771,48,Mar
510,"Weed, Alcohol or Coffee - What Is More Harmful? | BeerBiceps Fitness",2017-03-11,757311,31019,1296,Mar
511,Easy Way To Get A Shredded Body Look | BeerBiceps G-Flux 101,2017-03-09,506376,17324,664,Mar
512,Do Our Grades Matter? | Ranveer's LifeHacks | BeerBiceps,2017-03-07,185527,14262,803,Mar
513,Why Should Women Lift Weights? | Fat To Fit Transformation Story | Kripa Jalan On The Ranveer Show,2017-03-04,447624,9067,344,Mar
514,Meditation At Home For BEGINNERS - Why YOU Should Meditate | BeerBiceps Meditation,2017-03-02,1171553,77806,1137,Mar
515,Fitness QnA 2 | BeerBiceps Livestream 5,2017-03-01,7092,783,69,Mar
516,How To Overcome Sadness In Life | Ranveer's LifeHacks | BeerBiceps,2017-02-28,225134,11226,288,Feb
517,YouTube Live Stream Surprise | BeerBiceps Livestream 4,2017-02-26,9676,1144,103,Feb
518,The Dirty Truth Behind BULKING And CUTTING - Bulk & Cut 101 | BeerBiceps,2017-02-25,131443,4572,204,Feb
519,PCOS/PCOD Diet Science + FREE Plan For Weight Loss / PCOS Cure Diet | BeerBiceps Women's Health,2017-02-23,1481832,54033,2278,Feb
520,KILL Bad Habits FOREVER | Ranveer's LifeHacks | BeerBiceps,2017-02-21,145021,5635,222,Feb
521,Secret To Happiness | BeerBiceps Europe Trip,2017-02-18,71679,2137,131,Feb
522,How To Cut Fat Without Losing MUSCLE | BeerBiceps Bulk to CUT,2017-02-16,206026,6293,303,Feb
523,PROVE THEM WRONG - How To Deal With DOUBTERS & NEGATIVE People | Ranveer's LifeHacks | BeerBiceps,2017-02-14,105973,6523,195,Feb
524,Does Sleep Help You To Burn Fat? | Tips For Good Sleep | BeerBiceps,2017-02-11,333461,14117,361,Feb
525,Is BCCA Good For Your Body? | BeerBiceps BCAA 101,2017-02-08,483961,10688,728,Feb
526,How To STAY MOTIVATED | Ranveer's LifeHacks | BeerBiceps,2017-02-06,48086,2366,90,Feb
527,HEALTHY Butter Chicken | Indian Recipes for Weight Loss | BeerBiceps Chicken Makhani,2017-02-04,139204,4147,118,Feb
528,SECRET Behind CUTS & SIZE - Hypertophy 101 | How To Get Cuts On Your Body | BeerBiceps,2017-02-02,160055,5501,140,Feb
529,From FAILURE To SUCCESS | How To Deal With Failure | Ranveer's LifeHacks | BeerBiceps Motivation,2017-01-31,68727,4269,159,Jan
530,Easy And Quick Paneer Dishes | BeerBiceps Recipes,2017-01-29,704334,19780,245,Jan
531,Is KETOGENIC Diet SAFE? | BeerBiceps Keto,2017-01-26,75422,1653,239,Jan
532,"EPIC Cheat Day - 5 Gardens, Open Gym, Best South Indian food | BeerBiceps Vlog 4",2017-01-22,224433,8817,371,Jan
533,"NEVER Get Injured - Exercise Injuries 101 - Prevention, Treatment, Recovery | BeerBiceps",2017-01-19,78527,3351,123,Jan
534,Your Crush Has A Crush On You! Find Out How | BeerBiceps Relationships,2017-01-16,504634,19568,457,Jan
535,Beginner's CHICKEN Cooking - Top 5 Tips | BeerBiceps Cooking Tutorials,2017-01-14,231270,7708,207,Jan
536,Goodbye Forever ACNE - Pimples Treatment 101 | BeerBiceps Acne & Fitness,2017-01-12,1734982,63519,1505,Jan
537,MS Dhoni Vs. Virat Kohli - Who Is The Best Leader? | Ranveer's LifeHacks | BeerBiceps,2017-01-10,74185,3770,254,Jan
538,Best Burger in Mumbai | BeerBiceps Vlog 3,2017-01-08,111680,3322,155,Jan
539,Thankyou 100K Subscribers | BeerBiceps,2017-01-07,54712,3255,321,Jan
540,My Transformation - Fat Powerlifter To Aesthetic Strength - Training Program | BeerBiceps,2017-01-05,187768,5089,242,Jan
541,Fat Shaming Is Fuel - Ranveer's LifeHacks | BeerBiceps Fat Shaming,2017-01-02,56883,3713,154,Jan
542,TOP 5 Hangover Cure Recipes | BeerBiceps Quick & Easy Recipes,2017-01-01,17793,480,29,Jan
543,Does Beer Gives You A BELLY | Beer & Fitness 101 | BeerBiceps,2016-12-29,1496122,40192,1597,Dec
544,How To Deal With Competition | Ranveer's LifeHacks | BeerBiceps,2016-12-27,17969,1155,84,Dec
545,The Fitness Test - 100 Km. Trek | BeerBiceps Vlog 2,2016-12-25,51702,2343,111,Dec
546,Best Way To Workout During Periods | BeerBiceps Women's Fitness,2016-12-22,344665,19193,738,Dec
547,Easy Ways To Be Confident While Talking To Anyone | BeerBiceps,2016-12-20,508687,21523,484,Dec
548,Paneer Methi Malai - Keto Paneer Recipe | BeerBiceps Vegetarian Ketogenic Diet,2016-12-18,85279,1363,126,Dec
549,Why I Will NEVER Do Steroids | Ranveer's LifeHacks | BeerBiceps,2016-12-13,70030,3102,285,Dec
550,"Best Day Of My Life - Aamir Viral Video Outcome, AIB Shoot, Meeting Tanmay | BeerBiceps Vlog 1",2016-12-10,175259,5460,235,Dec
551,Revealing The Dark Side Of Steroid Use In Bollywood | BeerBiceps Fitness,2016-12-07,559559,18583,1622,Dec
552,How I Deal With HATE - Ranveer's LifeHacks | BeerBiceps,2016-12-06,79998,7164,582,Dec
553,Beginner's Egg Cooking - Top 10 Tips | BeerBiceps Cooking Tutorials,2016-12-04,224177,7781,219,Dec
554,Aamir Khan's DIRTY SECRET - Dangal Transformation Natural? | BeerBiceps Steroids Talk,2016-11-30,733492,29741,2047,Nov
555,How To Chase Your DREAMS - Ranveer's LifeHacks | BeerBiceps,2016-11-29,44991,2391,156,Nov
556,Easy Thai Prawn Stir Fry | Thai Cooking TUTORIAL | BeerBiceps Prawns Recipes,2016-11-27,20714,279,18,Nov
557,Complete PCOS/PCOD Guide | BeerBiceps Health,2016-11-24,357615,24175,810,Nov
558,Be CONFIDENT In ANY Situation - Ranveer's LifeHacks | BeerBiceps,2016-11-21,175237,8190,307,Nov
559,Easy Mangalorian Chicken - Chicken Pulimunchi | BeerBiceps Healthy Indian Curry,2016-11-20,25989,645,25,Nov
560,Calisthenics Or Gym - What Is Better? | BeerBiceps Fitness,2016-11-17,307820,11688,635,Nov
561,BEAT HEARTBREAK Like A BOSS! - Ranveer's LifeHacks | BeerBiceps,2016-11-14,88888,5029,230,Nov
562,Keto Paneer Recipe - Paneer Hariyali Tikka | BeerBiceps Vegetarian Ketogenic Diet,2016-11-13,204266,3536,163,Nov
563,Easy Weight Loss Technique For Women - Top 5 Women's Fitness Tips | BeerBiceps Women's Fitness,2016-11-10,1350159,65802,2360,Nov
564,5 Tips For Becoming A Successful Entrepreneur - Ranveer's Life Hacks | BeerBiceps,2016-11-08,22599,1558,193,Nov
565,Kaju Paneer Curry | BeerBiceps Healthy Indian Paneer Recipes,2016-11-06,24914,676,62,Nov
566,Build A Muscular Body Without Supplements | BeerBiceps Fitness,2016-11-03,555683,20585,1164,Nov
567,Healthy Sheera - Diwali Dessert | BeerBiceps Indian Vegetarian Recipes,2016-10-30,22968,630,57,Oct
568,Vegetarian Keto Diet Plan For Weight Loss | BeerBiceps Fitness,2016-10-27,701640,14791,980,Oct
569,Chinese Omelette - Easy Egg Recipes | BeerBiceps Breakfast Recipes,2016-10-23,206637,4517,99,Oct
570,"Thank You For 50,000 Subscribers | BeerBiceps",2016-10-20,5371,420,122,Oct
571,Find Out Which Weight Is Best For Your Body - Heavy or Light | BeerBiceps Muscle Building Advice,2016-10-20,423397,14893,536,Oct
572,EPIC Cheat Meal - Chicken Burger | BeerBiceps High Protein Recipes,2016-10-16,112336,3326,146,Oct
573,World's Healthiest Cuisine? | BeerBiceps WEIGHT LOSS Advice,2016-10-13,115392,4040,247,Oct
574,Honey Smoked Chicken Salad | BeerBiceps Easy Keto Salad Recipes,2016-10-09,41161,820,33,Oct
575,Ranveer Singh Shoulder Workout | BeerBiceps Bollywood Bodies,2016-10-06,162298,3237,127,Oct
576,Honey Chilli Chicken - Healthy Indian Chinese Recipe | BeerBiceps Chicken Recipes,2016-10-02,31425,831,34,Oct
577,Is Soya Recommended For Body Builders? | BeerBiceps Fitness,2016-09-29,1106701,43977,1689,Sep
578,Best Punjabi Chola Masala | High Protein | BeerBiceps Recipe,2016-09-25,310874,7229,253,Sep
579,The BEST Weight Loss Advice You'll Get | BeerBiceps Weight Loss Motivation,2016-09-21,51927,1597,97,Sep
580,Keto Chicken Breast Crown | BeerBiceps Keto Chicken Recipe,2016-09-18,113641,1829,63,Sep
581,Lift Up Your Mood After A BreakUp | Breakup Motivation | BeerBiceps Fitness Motivational Video,2016-09-14,582359,18501,537,Sep
582,Palak Paneer - Indian Spinach Recipe | BeerBiceps Healthy Punjabi Food,2016-09-11,48835,1008,91,Sep
583,John Abraham Arm Workout - Detailed Arm Workout Plan In Gym | BeerBiceps,2016-09-08,195885,4382,163,Sep
584,Mutton Keema Masala | BeerBiceps Recipes,2016-09-04,31827,830,54,Sep
585,How India Can Win More Medals At The Olympics | BeerBiceps,2016-09-01,10835,708,93,Sep
586,Best Fusion Omelette | Healthy Recipes | BeerBiceps Recipes,2016-08-28,881803,16443,400,Aug
587,Chest Workout Plan | How To Get A Body Like Varun Dhawan | BeerBiceps Fitness,2016-08-25,394288,9734,328,Aug
588,Keto Chicken Breast Pockets With Bacon | BeerBiceps Ketogenic Diet Recipes,2016-08-21,34468,438,87,Aug
589,THIS Is How How Lose Weight - Diet Motivation | BeerBiceps,2016-08-18,459530,14750,502,Aug
590,Soya Curry - South Indian Soya Chunks Recipe | BeerBiceps Healthy Vegetarian Recipes,2016-08-14,48024,1198,44,Aug
591,Become A BETTER Athlete - Football Fitness Training | BeerBiceps,2016-08-11,46281,2356,126,Aug
592,Curry Roast Chicken - Keto Indian Chicken Recipe | BeerBiceps Ketogenic Diet,2016-08-06,71230,1163,74,Aug
593,Does Green Tea Help You With Weight Loss? | BeerBiceps Fitness,2016-08-04,740964,21609,599,Aug
594,Mushroom Stuffed Omelette - Easy Egg Recipe | BeerBiceps Breakfast Recipes,2016-07-30,19649,476,26,Jul
595,Are There Any Side Effects Of Creatine? | BeerBiceps Fitness,2016-07-28,756412,25423,986,Jul
596,Lemon Chicken With Keto Greens | Easy & Best Keto Recipe | BeerBiceps Fitness,2016-07-24,664752,13559,325,Jul
597,Keto Refeed Day 101 - Carb Up To Lose Weight | BeerBiceps Ketogenic Diet,2016-07-21,102232,2651,235,Jul
598,Healthy Paneer Tikka Masala - Indian Bodybuilding Recipes | BeerBiceps Vegetarian,2016-07-17,129289,3060,76,Jul
599,Pokemon Go Is Your Belly Fat SOLUTION | BeerBiceps Weight Loss Advice,2016-07-13,17232,508,42,Jul
600,Healthy Paneer Chilli | BeerBiceps Vegetarian Indian Chinese Style Recipes,2016-07-10,156433,3288,118,Jul
601,Salman Khan Leg Workout - Lower Body Workout In Gym | BeerBiceps Bollywood Bodies,2016-07-07,65406,1585,92,Jul
602,Simple & Easy Recipe To Make Paneer At Home | BeerBiceps,2016-07-03,308219,8224,191,Jul
603,Hrithik Roshan Back Workout - Detailed Back Workout in Gym | BeerBiceps Bollywood Bodies,2016-06-30,225744,4176,196,Jun
604,High Protein & Fat Free Khichda | BeerBiceps Vegetarian Bodybuilding Recipes,2016-06-26,303935,5923,223,Jun
605,Detailed Diet Plan for FAST Fat Loss - Ketogenic Diet  | BeerBiceps Keto Weight Loss,2016-06-23,1942544,34181,1481,Jun
606,Build Muscle FAST - The Science Of Weight Training | BeerBiceps,2016-06-19,275647,9108,185,Jun
607,"Thank You For 10,000 Subscribers | BeerBiceps",2016-06-16,7777,486,114,Jun
608,Upma - Healthy Indian Vegetarian Recipes | BeerBiceps Breakfast,2016-06-12,152343,3874,192,Jun
609,Bollywood Bodies - BeerBiceps FREE Training Program | BB Summer Level 2,2016-06-09,18107,447,66,Jun
610,Fitness Motivation India | BeerBiceps Motivational,2016-06-04,182199,3032,170,Jun
611,My KETO Experience - Mistakes & Advice | Weight Loss & Bodybuilding Ketogenic Diet | BeerBiceps,2016-06-02,296378,5702,537,Jun
612,"Ketogenic Diet 101 - The FASTEST Weight Loss Diet | Details, Benefits & Results | BeerBiceps Health",2016-05-29,3454749,60260,3405,May
613,Ramzan Training & Diet Plan for MUSCLE BUILDING - How To Lose Weight In Ramadan | BeerBiceps,2016-05-25,100767,7087,672,May
614,Easy Roast Chicken | BeerBiceps Keto Recipes,2016-05-22,88860,856,56,May
615,Tanmay Bhat Weight Loss Motivation | BeerBiceps BB Summer,2016-05-18,65211,1370,82,May
616,Healthy Italian Grilled Fish | BeerBiceps Keto Diet Recipes,2016-05-14,50693,559,42,May
617,How To Transform From Skinny To Ripped | BeerBiceps Fitness,2016-05-11,483738,13377,411,May
618,Kerela Chicken - Indian Keto Recipes | BeerBiceps Chicken Recipes,2016-05-08,224300,3378,184,May
619,The Cheat Meal Guide - Eat What You Want & Stay Thin | BeerBiceps Diet Advice,2016-05-05,210649,6890,190,May
620,Protein Omelette | BeerBiceps Bodybuilding Breakfast Egg Recipes,2016-05-01,86623,1193,74,May
621,Best Protein Powder For Different Body Types | BeerBiceps Fitness,2016-04-28,1035956,24438,1085,Apr
622,Best Health Cooking Hacks | BeerBiceps Diet Food,2016-04-24,16481,626,46,Apr
623,BB Summer - Free & Guided Weight Loss Plan | BeerBiceps Fitness,2016-04-21,782610,19189,780,Apr
624,Chicken Seekh Kabab - Keto Recipes Indian Style | BeerBiceps Chicken Recipe,2016-04-17,194660,3356,112,Apr
625,Full Body Transformation Routine For Men and Women | BB Summer | BeerBiceps Fitness,2016-04-14,715900,17350,532,Apr
626,Smart Dieting - How To Diet And Lose Weight Fast For MEN & WOMEN | BeerBiceps Diet Advice,2016-04-10,231614,7818,227,Apr
627,BB Summer - FREE & Guaranteed Weight Loss | BeerBiceps Fitness,2016-04-07,93727,3643,292,Apr
628,Best Tandoori Chicken Recipe | BeerBiceps Recipes,2016-04-03,205414,3863,160,Apr
629,3 Tips To Select The Best Gym | BeerBiceps Fitness,2016-03-31,330798,12013,420,Mar
630,Paneer Bhurji | BeerBiceps Vegetarian Recipes,2016-03-27,323822,9072,206,Mar
631,Vegetarian Diet Plan For Bodybuilding | BeerBiceps Fitness,2016-03-24,906184,30301,1504,Mar
632,Paneer Pakora Recipe | BeerBiceps HEALTHY Vegetarian,2016-03-20,96441,2908,102,Mar
633,Triceps Workout For Beginners | BeerBiceps Workout,2016-03-17,133428,3945,91,Mar
634,South Indian Egg Bhurji | BeerBiceps Healthy Breakfast Recipes,2016-03-13,35408,676,47,Mar
635,How Many Eggs Should I Eat A Day | BeerBiceps Diet,2016-03-10,1062773,35126,1617,Mar
636,Chicken Green Curry | Diet Food | BeerBiceps Recipe,2016-03-06,6685,194,39,Mar
637,Chest Workout For Beginners | BeerBiceps Workout,2016-03-03,139556,3368,67,Mar
638,Stuffed Masala Omelette | BeerBiceps Healthy Breakfast Recipes,2016-02-28,423120,8177,297,Feb
639,Fitness Motivation India | BeerBiceps Motivation,2016-02-25,25157,1068,84,Feb
640,Full Day Of Eating | INDIAN Diet For Bodybuilding | BeerBiceps Lean Bulking Diet,2016-02-21,620461,17577,949,Feb
641,Find Out The How Much Protein Your Body Needs | Muscle Building | BeerBiceps Fitness,2016-02-18,654587,22189,891,Feb
642,Dry Chicken Recipe - Healthy Tawa Chicken For Fat Loss and Bodybuilding | BeerBiceps Recipes,2016-02-14,152097,4089,177,Feb
643,Top 3 Methods To Reduce MUSCLE SORENESS After Workout | BeerBiceps Gym Tips,2016-02-11,1725776,45691,1837,Feb
644,Soya Tikki - Indian Snacks Recipes | BeerBiceps Recipes,2016-02-07,31858,795,66,Feb
645,How To Lose Weight Fast At Home - What After Sugar? | BeerBiceps Diet Tips,2016-02-04,75502,2411,122,Feb
646,Smoked Masala Lady Fish Fry | Diet Food | BeerBiceps Recipes,2016-01-31,72795,652,59,Jan
647,Low Budget & Affordable Diet Plan | BeerBiceps Fitness,2016-01-28,552494,10847,713,Jan
648,Best Soya Bhurjee Recipe | Diet Food | BeerBiceps Recipes,2016-01-24,642706,20156,632,Jan
649,Are Fruits Good For Weight Loss ? | Is Fruit Sugar Bad For You ? | BeerBiceps Food Diet,2016-01-21,116478,3571,226,Jan
650,General FITNESS QnA | BeerBiceps Livestream 3,2016-01-17,6043,130,26,Jan
651,Is Non-Vegetarian Food Good Or Bad For Health? | BeerBiceps Diet Food,2016-01-14,131308,3206,993,Jan
652,Grilled Chutney Fish - Healthy Fish Recipes | Weight Loss Recipe | BeerBiceps Diet Food,2016-01-10,8166,163,9,Jan
653,Why Every Human Should Consider Taking Up Weight Training | BeerBiceps Livestream 2,2016-01-07,5852,151,11,Jan
654,Biceps Workout For Beginners | BeerBiceps Workout,2016-01-07,285200,7294,155,Jan
655,The BeerBiceps Introduction | BeerBiceps Live Stream,2016-01-05,9423,304,38,Jan
656,Paneer Cheese Kabab | High Protein Vegetarian Recipes | BeerBiceps Diet Food,2016-01-03,243287,3229,70,Jan
657,Can You Stay Fit By Drinking Alcohol? | Alcohol & Fitness | BeerBiceps,2015-12-30,302416,8125,415,Dec
658,Weight Loss Challenge For Beginners - #BB40Challenge FAQs | BeerBiceps,2015-12-27,23928,584,54,Dec
659,How To Choose Best Supplement Powder In India - Bodybuilding | BeerBiceps Fitness,2015-12-24,721865,15846,736,Dec
660,Healthy Indian Fish Recipes For Weight Loss - GRILLED Pomfret Recipe | BeerBiceps Food,2015-12-20,222735,1959,85,Dec
661,Weight Loss Challenge For Beginners | Fitness Plan | BeerBiceps Fitness,2015-12-17,414326,9894,697,Dec
662,Peanut Masala Paneer | HEALTHY Paneer Recipes for BODYBUILDING | BeerBiceps Diet,2015-12-13,73225,2015,84,Dec
663,How To Kill Your Cravings? | BeerBiceps Diet,2015-12-10,354995,16673,563,Dec
664,Shoulder Workout For Beginners - Dumbbells And Free Body | BeerBiceps Workout,2015-12-03,122832,3891,76,Dec
665,My Message To 40+ Indians Everywhere - BeerBiceps Motivation,2015-11-26,8369,317,26,Nov
666,Healthy Egg Pav Bhaji - High Protein Shakshuka | BeerBiceps Food,2015-11-22,28939,524,37,Nov
667,Back Workout For Beginners | BeerBiceps Workout,2015-11-19,85487,2479,78,Nov
668,Veg Diet For Bodybuilding - HIGH PROTEIN Vegetarian Diet | BeerBiceps Diet,2015-11-12,56458,1706,147,Nov
669,Push Up Variations For Beginners - 5 Variations | BeerBiceps Workout,2015-11-05,289491,10420,202,Nov
670,How To Squat For Beginners - Free & Weighted | BeerBiceps Workout,2015-10-29,226110,7806,227,Oct
671,Should Girls Lift Weights? - 4 Biggest Benefits | BeerBiceps Fitness,2015-10-22,32579,1784,93,Oct
672,How To Lose Weight & Get Lean | BeerBiceps Workout,2015-10-15,497940,13606,503,Oct
