,Title,Published_date,Views,Likes,Comments,Month
673,How To Reduce Belly Fat Easily - Detailed Explanation | BeerBiceps Fitness,2015-10-11,1730047,49789,1279,Oct
674,Whole Grilled Fish - Chinese Style | Healthy Recipe - BeerBiceps Food,2015-10-08,155057,846,46,Oct
675,What Are The Benefits & Side Effects Of Whey Protein | The Scientific Truth | BeerBiceps Gym Tips,2015-10-04,690624,20862,802,Oct
676,BEST Fat Loss Workout For Indian Women | BeerBiceps Fitness,2015-10-01,679659,24832,724,Oct
677,Food To Gain Weight For Men & Women - BeerBiceps Diet Advice,2015-09-27,67518,2279,72,Sep
678,How To Put On Weight Faster | BeerBiceps Fitness,2015-09-24,237323,6142,206,Sep
679,Tandoori Chicken Recipe (Fat Free) - Healthy Indian Food For Bodybuilding | BeerBiceps Food,2015-09-20,339632,7897,280,Sep
680,Healthy Chicken Recipe - How To Cook Juicy Chicken Breast | BeerBiceps Food,2015-09-17,232886,3202,117,Sep
681,What Should I Eat After A Workout - Post-Exercise Nutrition | BeerBiceps Diet,2015-09-13,84940,2831,112,Sep
682,What Should I Eat Before A Workout - Pre-Exercise Nutrition - BeerBiceps Diet,2015-09-10,189163,6182,188,Sep
683,Vegetarian Bodybuilding Diet - THE SCIENCE AND TRUTH - BeerBiceps Vegetarian Fitness,2015-08-30,81208,2111,127,Aug
684,How Many Reps Should You Do To Build Muscle? | The TRUTH And SCIENCE | BeerBiceps Gym Tips,2015-08-26,58268,3569,149,Aug
685,Are Carbs Good Or Bad? - The TRUTH And SCIENCE | BeerBiceps Diet Tips,2015-08-19,68429,2581,134,Aug
686,Slow Roasted Pork Shoulder Recipe - India Specific | BeerBiceps,2015-08-16,99297,1283,314,Aug
687,How To Lose Weight Fast For INDIANS - TOP 5 DIET TIPS | BeerBiceps Fitness,2015-08-15,50828,1337,64,Aug
688,Gym Tips For Beginners In India | BeerBiceps Gym Tips,2015-08-15,102438,3246,116,Aug
689,The Introduction | BeerBiceps,2015-08-15,260144,10209,700,Aug
