,Title,Published_date,Views,Likes,Comments,Month
207,Indian Billionaire On The 1 Biggest Mistake Of ALL INDIANS | Kunal Shah On The Ranveer Show,2020-12-23,1066407,52434,1495,Dec
208,"Sea Monsters, Beasts & REALITY About The Oceans ft. @Abhi and Niyu | The Ranveer Show 86",2020-12-19,557791,27163,758,Dec
209,Former Monk Jay Shetty Explains The End Goal Of Meditation | The Ranveer Show,2020-12-15,82536,5785,238,Dec
210,"Vishen Lakhiani On ""Retraining Your Mind"" For Growth, Riches & Peace | The Ranveer Show 85",2020-12-11,187577,9434,1278,Dec
211,"""How Meditation Built My Billionaire Career"" - Alok Kejriwal's Spiritual Story | The Ranveer Show 84",2020-12-08,93913,4235,208,Dec
212,"Alok Kejriwal On Indian Gaming, Learnings From China & Spiritual Growth | The Ranveer Show 83",2020-12-04,61113,2911,227,Dec
213,3 Steps To Make THIS Year Your Biggest Year Ever | BeerBiceps,2020-12-01,251359,23885,751,Dec
214,Conversation With A Billionaire - The INSPIRING Harsh Mariwala Story | The Ranveer Show 82,2020-11-27,168034,8741,482,Nov
215,"""The Ugly Truth About Fame"" - @Lauv On Mental Health, Love & Spirituality | The Ranveer Show 81",2020-11-20,162851,10436,970,Nov
216,Author: Almanack Of Naval Ravikant Eric Jorgenson | Blockchain & Elon Musk | The Ranveer Show 80,2020-11-13,229289,7153,947,Nov
217,The Twisted Secrets Of Your Brain - ​@Gad Saad On Evolutionary Psychology | The Ranveer Show 79,2020-11-06,189978,8000,662,Nov
218,"6 PRACTICAL Hacks That Will Make You Rich, Loved & Peaceful | BeerBiceps",2020-11-03,312022,28393,1427,Nov
219,"CEO Radhika Gupta On Overcoming Su*cide, Feminine Energy, Goals & Ambitions | The Ranveer Show 78",2020-10-30,444373,19236,958,Oct
220,"Tamannaah Bhatia On Relationships, Career Growth Mentality & Covid Experience | The Ranveer Show 77",2020-10-23,1830975,62262,3041,Oct
221,"​@Abhi and Niyu On India's Future, Content Entrepreneurship & Indian Policies | The Ranveer Show 76",2020-10-16,536016,31736,1592,Oct
222,"Captain Raghu Raman On Army Life, Siachen & Combat Mentality | The Ranveer Show 75",2020-10-09,1282783,39009,2091,Oct
223,@Armaan Malik's Inspiring Journey From Bollywood To International Pop | The Ranveer Show 74,2020-10-02,320674,16705,1047,Oct
224,"@Jay Shetty On Meditation, Spirituality & How To Think Like A Monk | The Ranveer Show 73",2020-09-25,1109091,53471,2831,Sep
225,UNICORN Cred Founder Kunal Shah's Powerful Tips For Wealth & Success | The Ranveer Show 72,2020-09-18,1144186,58692,4376,Sep
226,"@Teachingmensfashion On Early Struggles, Hustle Culture and Entrepreneurship | The Ranveer Show 71",2020-09-11,546452,34746,1847,Sep
227,"Ankur @warikoo On Alien Encounters, Souls, Life & Time Travel | The Ranveer Show 70",2020-09-04,475815,20056,1176,Sep
228,Money Expert Explains Financial Basics For Indians - Nithin Kamath (Zerodha) | The Ranveer Show 69,2020-08-28,216835,11033,811,Aug
229,The Success Story Of Zerodha's SMART Business Journey ft. Nithin Kamath | The Ranveer Show 68,2020-08-25,567352,19935,1021,Aug
230,Utth Jaa Rey - Hindi Song | Harshil Karia X BeerBiceps,2020-08-21,660273,48311,1915,Aug
231,6 Successful Men Explain The POWER Of Semen Retention | NoFap Motivation | The Ranveer Show,2020-08-18,2992182,132000,6364,Aug
232,My Ayahuasca Story - The Experience That Changed My Life | The Ranveer Show 67,2020-08-14,1449615,65168,6549,Aug
233,"@Prateek Kuhad On Love Life Learnings, Songwriting Process & Success Mantras | The Ranveer Show 66",2020-08-07,186934,6804,412,Aug
234,Indian Education System Changes Explained In Detail ft. Dr.Radhakrishnan Pillai |The Ranveer Show 65,2020-07-31,208480,13566,1068,Jul
235,Devastating Covid-19 IMPACT On The Restaurant Industry ft. Riyaaz Amlani | The Ranveer Show 64,2020-07-24,94741,3748,219,Jul
236,"Kamasutra, S*x & Romance Secrets With @Seema Anand StoryTelling | The Ranveer Show 63",2020-07-17,1563094,48825,2618,Jul
237,Casual S*x Vs. Serious Relationships - My True Personal Story | The Ranveer Show 62,2020-07-10,1640550,85590,3217,Jul
238,"""200 Days Without Masturbation Changed Me Forever."" - Viraj Sheth | The Ranveer Show 61",2020-07-03,735192,32082,2238,Jul
239,REAL Power Of Manifestation Explained In 4 Minutes ft. Ayushmann Khurrana | The Ranveer Show,2020-06-30,1506170,90307,1001,Jun
240,India's CRAZY Untold History With Author Amish Tripathi | The Ranveer Show 60,2020-06-26,549277,26888,1880,Jun
241,"​@Gurudev Sri Sri Ravi Shankar On Meditation, Spirituality, Atheism And More | The Ranveer Show 59",2020-06-19,243327,12389,1028,Jun
242,The Ranveer Show - Happiness Through Curiosity,2020-06-16,574953,21762,1040,Jun
243,"Dr. Vivek Bindra On Self Motivation, NoFap & The Future of Business In India | The Ranveer Show 58",2020-06-12,1814793,105882,5258,Jun
244,Want NEXT LEVEL MOTIVATION? Watch This - 3 NBA Stories | NBA Explained | The Ranveer Show 57,2020-06-09,145783,10749,978,Jun
245,My Honest Mental Health Confession - How I Overcame Pain & Self Doubt | The Ranveer Show 56,2020-06-05,287210,23668,1696,Jun
246,Monk Explains Bhagawad Gita In 7 Minutes - Gaur Gopal Das & BeerBiceps | The Ranveer Show,2020-06-02,4219586,196490,3862,Jun
247,5 TV Shows That Changed Me Forever (Available Online) | The Ranveer Show 55,2020-05-29,338931,20500,1072,May
248,"Tiger Shroff On Dragon Ball Z, Fitness, Ambitions, Motivation & Legacy | The Ranveer Show 54",2020-05-26,391224,22369,966,May
249,My TOP 8 Learnings For Life After Covid-19 | The Ranveer Show 53,2020-05-22,204652,13852,748,May
250,YOUTUBE VS TIKTOK - Who Is The Real LOSER? | The Ranveer Show 52,2020-05-19,433650,42595,4540,May
251,Self Made Media Crorepati - Sahil Khattar On His 5 Simple Success Secrets | 83 | The Ranveer Show 51,2020-05-15,271788,11189,530,May
252,The Inspiration Behind BeerBiceps | Meet My Mother | Mother's Day Special | The Ranveer Show 50,2020-05-10,920519,42207,2543,May
253,"OYO's Founder Ritesh Agarwal On Future Of Startups, Inspirations & Covid-19 | The Ranveer Show 49",2020-05-08,358579,14697,802,May
254,"@Raftaar On Career Secrets, Life Goals And Rap Culture In India | The Ranveer Show 48",2020-05-01,480474,35620,1749,May
255,Multiply Money Through Real Estate ft. Yash Talreja | The Ranveer Show 47,2020-04-24,487830,22110,1565,Apr
256,Lockdown Getting To Your Head? Watch This. | BeerBiceps Motivation,2020-04-21,295105,24335,771,Apr
257,"@alpha m. On Hard Work, Money Multiplication & Love Life | Aaron Marino On The Ranveer Show 46",2020-04-17,532327,33879,2244,Apr
258,AGHORIS - The Dark Side Of Spirituality ft. Kiran Khalap | The Ranveer Show 45,2020-04-14,1427902,57834,2452,Apr
259,Harshil Karia On Sacrificing For Success | How To Build A Successful Startup | The Ranveer Show 44,2020-04-11,575997,18494,701,Apr
260,5 BIG Love Lessons From My Past 5 Relationships | The Ranveer Show 43,2020-04-07,973272,70166,4431,Apr
261,10 Movies that will change you FOREVER | The Ranveer Show 42,2020-04-03,915409,44694,3775,Apr
262,"CEO Ashok Ramachandran On Failing Exams, Corporate Mega Success & Leadership | The Ranveer Show 41",2020-03-27,216353,9661,622,Mar
263,"Ayush Mehra on Love, Long Term Relationships and His Girlfriend of 14 years | The Ranveer Show 40",2020-03-20,953237,43615,986,Mar
264,The Coronavirus EFFECT On YOUR MONEY | COVID Rules | The Ranveer Show 39,2020-03-18,90209,4176,271,Mar
265,"@Gaur Gopal Das On His Childhood, Relationships, Life Lessons And Spirituality | The Ranveer Show 38",2020-03-13,3438093,112446,3615,Mar
266,"Glenn McGrath On Mental Fitness, Career Stories & Australia | The Ranveer Show 37",2020-03-06,149467,7422,486,Mar
267,"Ronnie Screwvala On Career Growth Hacks, Love & Success | The Ranveer Show 36",2020-02-28,166978,6204,364,Feb
268,"Rahul Subramanian On Communication Skills, Engineering and Comedy Career | The Ranveer Show 35",2020-02-24,473152,19132,757,Feb
269,Arnold Schwarzenegger's 6 Rules of Success | BeerBiceps Motivation,2020-02-17,458002,31798,632,Feb
270,Conversation with a REAL King - Lakshyaraj Singh Mewar (Udaipur) | The Ranveer Show 34,2020-02-14,1217503,45082,2475,Feb
271,6 Steps To Become a Sexy Teen | BeerBiceps Short Film,2020-02-11,335184,27549,1358,Feb
272,Vidhu Vinod Chopra's Inspirational Life Story | The Ranveer Show 33,2020-02-04,123017,5648,569,Feb
273,"@Barkha Singh on Romance, Personal Finances & Success | The Ranveer Show 32",2020-01-31,1014195,40379,1538,Jan
274,"Rajeev Masand On Bollywood Gossip, Business Secrets & Roundtable Stories | The Ranveer Show 31",2020-01-24,467965,11841,1143,Jan
275,We Are LAUNCHING A New Channel - TRS Clips | BeerBiceps,2020-01-20,121869,9726,654,Jan
276,"Ashish Chanchlani On YouTube Growth Hacks, Bollywood & Career Inspirations | The Ranveer Show 30",2020-01-17,561086,28391,1334,Jan
277,Smash Your Fitness Goals | BeerBiceps Motivational Video,2020-01-13,191490,12541,347,Jan
278,"@Tanmay Bhat On His Comeback, Weight Loss, AIB & Finance | The Ranveer Show 29",2020-01-10,1872105,75296,2297,Jan
279,India's TOP Corporate Coach Radhakrishnan Pillai On Ancient Indian Career Hacks |The Ranveer Show 28,2020-01-03,584374,25806,618,Jan
280,How Semen Can Change Your Life - The NoFap Legend Sarvesh Shashi | The Ranveer Show 27,2019-12-27,3724951,112094,7453,Dec
281,Guide To ADVANCED MEDITATION ft. Radhakrishnan Pillai | The Ranveer Show 26,2019-12-20,968429,35531,1759,Dec
282,What Indians Are NOT Talking About | The Ranveer Show Bonus Episode,2019-12-17,288167,31561,2461,Dec
283,"DJ Bravo On Self Belief, Partying & Becoming LEGENDARY | Dwayne Bravo | The Ranveer Show 25",2019-12-13,152643,9206,421,Dec
284,Why Drugs Are Good For You ft. Luke Coutinho | The Ranveer Show 24,2019-12-06,374403,19294,1131,Dec
285,"Shilpa Shetty Kundra's Secrets To A Rich, Spiritual & Peaceful Life | The Ranveer Show 23",2019-11-29,1108005,37566,1804,Nov
286,"Siddharth Roy Kapur On Bollywood, Failures, Success & Leadership | The Ranveer Show 22",2019-11-22,283637,7955,519,Nov
287,Facing Death For A Living | India's Vegan Mountaineer - Kuntal Joisher | The Ranveer Show 21,2019-11-15,330859,13584,524,Nov
288,"Ayushmann Khurrana's Life Hacks on Confidence, Spirituality & Fitness | The Ranveer Show 20",2019-11-07,1071635,46443,2835,Nov
289,@Luke Coutinho's FREE OF COST Fitness Consultation (For All Body Types) | The Ranveer Show 19,2019-11-02,2249188,74349,2933,Nov
290,When I Met My Idol - Arnold Schwarzenegger | Terminator : Dark Fate | The Ranveer Show 18,2019-10-28,1410825,86544,2001,Oct
291,"Boman Irani's INSPIRING Life Story - Success, Failure, Humility & Brain Hacks | The Ranveer Show 17",2019-10-25,410689,16701,698,Oct
292,"Rajkummar Rao On Initial Struggle, Career Hacks & Bollywood Success Secrets | The Ranveer Show 16",2019-10-19,633308,28681,1076,Oct
293,"Saif Ali Khan On How To Be Rich, Classy, Charming And Woke | The Ranveer Show 15",2019-10-15,1160245,46119,2620,Oct
294,How To Be A SEXIER Man ft. Narendra Kumar | The Ranveer Show 14,2019-10-12,100387,4961,252,Oct
295,"Priyanka Chopra On Mental Health, Hollywood, Goals & Motivation | The Ranveer Show 13",2019-10-08,2140560,108931,3096,Oct
296,Narendra Kumar On Becoming The TOP FASHION DESIGNER From A Paperboy | The Ranveer Show 12,2019-10-04,69060,3296,253,Oct
297,Big Announcement 🙏 | BeerBiceps,2019-09-27,811708,51247,2192,Sep
298,The Man Who Changed My Life | Manish Pandey - My Mentor | The Ranveer Show 11,2019-09-20,588039,21297,1331,Sep
299,"Srishti Dixit On Anxiety, Mental Health & Meditation Hacks | The Ranveer Show 10",2019-09-13,310768,10720,1271,Sep
300,"Bollywood's UNTOLD Dark Truths, Secrets, Gossips And More ft. Renil Abraham | The Ranveer Show 09",2019-09-06,1524107,34075,6184,Sep
301,The Reality Of Indian Engineering ft. Viraj Sheth | The Ranveer Show - Episode 8,2019-08-30,480051,22162,1561,Aug
302,"Ahsaas Channa On Becoming A Digital Superstar | Work, Bollywood, Dating | The Ranveer Show 07",2019-08-23,633762,24315,856,Aug
303,What Indian Schools Don't Teach Us ft. Dr. Radhakrishnan Pillai | The Ranveer Show 06,2019-08-16,587666,24793,1114,Aug
304,How To Start A MILLION DOLLAR Startup - Step By Step With Ayush Jaiswal | The Ranveer Show 05,2019-08-09,438958,18703,633,Aug
305,"Vegetarianism, Masturbation, NoFap And Porn Addiction ft. Fit Tuber | The Ranveer Show 04",2019-08-02,1404446,78542,5796,Aug
306,How To Deal With Hate? | BeerBiceps Motivation,2019-07-27,113486,7484,266,Jul
307,What Every Man Must Know | BeerBiceps,2019-07-26,526917,9570,578,Jul
308,How Science Explains Spirituality ft. Abhijit Pradhan | The Ranveer Show 03,2019-07-19,265463,12205,842,Jul
309,Scary Dark Indian History ft. Radhakrishnan Pillai | The Ranveer Show 02,2019-07-12,741283,33110,1469,Jul
310,Honest Talks - Uncensored | BeerBiceps Livestream 33,2019-07-04,96931,5790,293,Jul
311,The BeerBiceps Startup Story ft. Viraj Sheth & Ranveer Allahbadia | The Ranveer Show 01,2019-06-21,493714,21325,728,Jun
312,How To Overcome Failures | The Inspirational Story of Manish Chowdhary | The Ranveer Show,2019-06-14,151441,6689,284,Jun
313,MostlySane's Secrets To RAPID Career Growth | Prajakta Koli On The Ranveer Show,2019-06-07,917187,40966,863,Jun
314,A Day With My Love | Meet My Family | BeerBiceps Vlog 10,2019-05-31,2213721,87212,2330,May
315,Chanakya Reborn - India's SMARTEST Man | Dr. Radhakrishnan Pillai On The Ranveer Show,2019-05-24,781737,35989,1255,May
316,This Self Made Millionaire's Story Will FIRE YOU UP 🔥 - Jimmy Mistry | The Ranveer Show,2019-05-17,534158,26588,1016,May
317,Indian Student? WATCH THIS To Open Your Eyes | Indian Education System | BeerBiceps,2019-05-10,951279,81268,3260,May
318,Money & Fame While Studying - The Slayy Point Story | The Ranveer Show,2019-05-03,2164621,124126,3210,May
319,The Secret Technique For IMPROVING Your Focus & Brain Power | BeerBiceps Motivation,2019-04-26,2495559,168343,2279,Apr
320,Saransh Goila's Journey From Being A Chef To A Successful Entrepreneur | The Ranveer Show,2019-04-19,180587,9639,415,Apr
321,​Mumbiker Nikhil's SECRET Success Mantra | The Ranveer Show,2019-04-12,1100194,75462,2851,Apr
322,Dream Come True | The BeerBiceps Office Tour,2019-04-05,1217701,53849,1790,Apr
323,The Hidden Rich Life Of Gaurav Kapur | The Ranveer Show,2019-03-29,855505,29261,1060,Mar
324,College Failure to Corporate King - Hitesh Malhotra | The Ranveer Show,2019-03-22,794027,26068,800,Mar
325,"THIS Is For YOU, My Family ❤️🙏 | BeerBiceps",2019-03-18,206053,14840,1137,Mar
326,From HEARTBREAK To SUCCESS - The Komal Pandey Story | The Ranveer Show,2019-03-15,2585536,100575,2561,Mar
327,​CarryMinati's REAL LIFE Story | The Ranveer Show,2019-03-08,9565772,516899,8718,Mar
328,This College Dropout is Making Indians VERY RICH ft. Aayush Jaiswal | The Ranveer Show,2019-03-01,1039633,47646,1667,Mar
329,The Inspiring Zakir Khan Story | Journey of India's MOST LOVED Comedian | The Ranveer Show,2019-02-21,1890325,100249,2448,Feb
330,I Wish I Knew THIS In COLLEGE | BeerBiceps,2019-02-11,230054,15902,649,Feb
331,How Ranveer Singh HACKED His Way To The TOP Of Bollywood | BeerBiceps Passion To Profession Guide,2019-02-08,402817,24503,931,Feb
332,Luke Coutinho​ - India's Most Positive Man | India's Biggest Health Trainer | The Ranveer Show,2019-02-01,948740,31006,1142,Feb
333,5 IMPORTANT Life Skills That Colleges SHOULD Teach You | BeerBiceps Career Advice,2019-01-26,134360,8165,425,Jan
334,If You Hate Your Job/Career - Watch This | Passion To Profession - Step By Step Guide | BeerBiceps,2019-01-22,195235,10276,364,Jan
335,7 Secrets of A Woman's Mind | How Do Women Think | Women's Dating Psychology | BeerBiceps,2019-01-20,449949,23435,986,Jan
336,This Is The REALITY Of My Life - Will You Help Me? | BeerBiceps,2019-01-15,282908,22352,977,Jan
337,India's MOST MOTIVATIONAL Legend - The Mahabharat | BeerBiceps,2019-01-11,609488,41963,1975,Jan
338,Inspiring Story Of India's Brightest Marketing Mind - Kiran Khalap | The Ranveer Show,2019-01-04,864264,27319,1153,Jan
339,Jeet Selal's Inspiring WAR For Fitness | Fitness Entrepreneurship | The Ranveer Show,2018-12-28,323188,23858,968,Dec
340,"Sejal Kumar On Mental Health, Entrepreneurship And Her HUSTLE | The Ranveer Show",2018-12-21,438260,18771,558,Dec
341,Ashish Chanchlani Success Story - His TOP Secrets | The YouTuber Family | The Ranveer Show,2018-12-14,4632079,220225,4388,Dec
342,The CUTEST CROREPATIS - MadhurasRecipe | Inspirational Love Story | The Ranveer Show,2018-12-07,601690,18648,852,Dec
343,99% Indians Are Making THIS HUGE MISTAKE | Biggest Self Improvement SECRET | BeerBiceps,2018-12-04,194772,12721,406,Dec
344,India's First Instagram Crorepati | The Aashna Shroff Story | The Ranveer Show,2018-11-30,2804868,91688,2748,Nov
345,What Every STONER Must Know | Truth About Marijuana | BeerBiceps Weed,2018-11-27,167661,11662,441,Nov
346,My Honest Depression Story | My Story Of Alcoholism | BeerBiceps Mental Health,2018-11-22,2115207,104246,2701,Nov
347,RAGS TO RICHES - The Inspiring Be YouNick Story - From Poverty To SUPERSTAR | The Ranveer Show,2018-11-16,2082376,121268,2892,Nov
348,Every 10th Standard Student Must Know This | Which Stream/Career To Choose In College | BeerBiceps,2018-11-12,132936,8111,598,Nov
349,Ask Me Anything - Rannu Bhai QnA | BeerBiceps Livestream 32,2018-11-08,42815,2809,206,Nov
350,Practical Studying Advice That NOBODY Will Give You | 10th & 12th Student Motivation | BeerBiceps,2018-11-06,215109,12654,381,Nov
351,Best Vacation Of My Life - USA | BeerBiceps Vlog 9,2018-11-01,83732,6064,435,Nov
352,How To Become Disciplined? - Success Mentality | BeerBiceps Mental Fitness,2018-10-29,249699,15554,463,Oct
353,Fittest City In The World - Los Angeles | BeerBiceps Vlog 8,2018-10-25,245129,16462,745,Oct
354,I HATE School / College - What Next? Career Guidance | BeerBiceps Motivation,2018-10-22,471878,31218,1273,Oct
355,World's Best Vegetarian Food - California Food | BeerBiceps Vlog 7,2018-10-18,84019,4578,338,Oct
356,ULTIMATE Online Fashion Shopping Guide - BEST Tips for Flipkart BBD Sale | BeerBiceps Men's Style,2018-10-09,265763,10759,634,Oct
357,Athleisure Clothing Basics For Men - Biggest Fashion Trend | BeerBiceps,2018-10-05,392624,14921,752,Oct
358,Sadhguru Talks About Traditional Indian Fashion Style | Indian Fashion Advice | The Ranveer Show,2018-09-29,233790,12386,420,Sep
359,Law Of Attraction Explained by Sadhguru | BeerBiceps Mental Fitness | The Ranveer Show,2018-09-28,163033,7542,310,Sep
360,Sadhguru On Cyber Bullying & Online Hate | BeerBiceps Mental Fitness | The Ranveer Show,2018-09-27,46585,2645,166,Sep
361,Sadhguru's Life Advice For College Students | Advice For Every 20 Year Old | The Ranveer Show,2018-09-26,1073412,61159,1308,Sep
362,6 TATTOO Style Secrets That You MUST KNOW | BeerBiceps Tattoo Advice,2018-09-13,1532918,65959,1613,Sep
363,3 Career Strategies That Will Change Your Future - Akshay Kumar | BeerBiceps Motivation,2018-09-06,581812,36412,1310,Sep
364,Ultimate Men's Shoe Collection With Prices | BeerBiceps Fashion Guide,2018-08-30,912126,28027,1710,Aug
365,Fashion & Lifestyle QnA - RAPID FIRE STYLE | BeerBiceps Livestream 31,2018-08-23,37111,2320,74,Aug
366,6 Steps to The BEST SLEEP Of Your Life - Sleep Meditation | BeerBiceps Night Time Routine,2018-08-16,562336,32945,1225,Aug
367,Scared About Life/Career? Watch This | Self Doubt Motivational Video | BeerBiceps Motivation,2018-08-09,202588,12665,560,Aug
368,Fitness/Mental Fitness Rapid Fire QnA | BeerBiceps Livestream 30,2018-08-02,40122,2531,127,Aug
369,5 HABITS Women LOVE - Men's Etiquette 101 | Good Manners For Personality Development | BeerBiceps,2018-07-26,545614,35485,1107,Jul
370,9 School/College Popularity Hacks that YOU MUST KNOW ft. Niharika NM | The Ranveer Show,2018-07-19,406374,17851,756,Jul
371,Top 10 Deodorants Under Rs.200 | Cheap And Attractive Deodorants | BeerBiceps Men's Grooming,2018-07-12,1684216,50495,2600,Jul
372,"EASY & BEST Skin Care Routine | Easy Solutions For Pimples, Dark Spots and Acne Removal | BeerBiceps",2018-07-05,4745172,153181,4010,Jul
373,Uncensored QnA - Burnout + Spirituality + Motivation | BeerBiceps Livestream 29,2018-06-28,54650,2903,151,Jun
374,Shaadi/Wedding Clothes - My Picks | BeerBiceps Livestream 28,2018-06-21,241766,6838,233,Jun
375,3 Most Important Teenage Life Lessons That Can Change Your Life | BeerBiceps Motivational Video,2018-06-20,2227387,153748,3260,Jun
376,How To Read ANYONE's Mind Like An Open Book - Body Language Secrets | BeerBiceps,2018-06-14,302909,17535,763,Jun
377,The 'How To Look HANDSOME' Tool Kit | Men's Grooming Products List | BeerBiceps Male Grooming,2018-06-07,729592,30998,1067,Jun
378,Bad Marks But Good Careers ft. MostlySane | The Ranveer Show,2018-05-24,580685,31532,1241,May
379,5 Easy Steps To Speak In ENGLISH Fluently And Confidently | English Speaking Tricks | BeerBiceps,2018-05-17,4613755,293352,5400,May
380,Watch This Video To Know My Business & Income Secrets | BeerBiceps Life Update,2018-05-10,166369,10793,548,May
381,6 Interview Hacks For Your First Job | BeerBiceps,2018-05-07,225940,13190,498,May
382,The HARDEST WORKING Man On YouTube - Gaurav Taneja | The Flying Beast Story | The Ranveer Show,2018-05-03,2292422,114768,2000,May
383,Gaurav Taneja Fitness Rapid Fire QnA 🔥 | BeerBiceps Livestream 27,2018-04-26,154808,5761,238,Apr
384,9 Short Guy Fashion Tips - INSTANTLY Look TALLER Than You Really Are | How to Look Tall | BeerBiceps,2018-04-23,913359,37364,2719,Apr
385,The Hindi Channel 'Ranveer Allahbadia' Is HERE | BeerBiceps,2018-04-19,137846,9210,1202,Apr
386,BIG Announcement | BeerBiceps Livestream 26,2018-04-19,45212,2436,181,Apr
387,Shahrukh Khan Fashion Breakdown - How EVERY MAN Can Dress Like A Superstar | BeerBiceps Men's Style,2018-04-16,261555,12983,1100,Apr
388,3 PRACTICAL Mental Tricks That Virat Kohli Used to TRANSFORM Himself | BeerBiceps Motivation,2018-04-12,1271259,68929,1544,Apr
389,My Perfume Collection and Recommendations - Fragrances for the Stylish Man | BeerBiceps,2018-04-09,933444,23176,1148,Apr
390,Solution To All Your Fitness Related Problems - Q&A | BeerBiceps Livestream 24,2018-04-05,42403,2704,167,Apr
391,Fitness QnA Part 2 | BeerBiceps Livestream 25,2018-04-05,27656,1169,130,Apr
392,Summer Trend For Men - Linen Clothes | BeerBiceps,2018-04-02,253998,11564,674,Apr
393,To My 1 Million Special Subscribers | BeerBiceps,2018-03-29,112232,11408,1578,Mar
394,Get Motivated In 2 Minutes With Your Favourite YouTube Creators - YTFF 2018 | BeerBiceps Motivation,2018-03-25,193784,17089,872,Mar
395,PASSION To PROFESSION - 100% Guaranteed Way To Find Practical Passion | BeerBiceps Motivation,2018-03-22,163520,10518,889,Mar
396,My Stylish Mens Wear Sneaker Collection | BeerBiceps Men's Style,2018-03-19,1331626,41517,1881,Mar
397,"EASY Method To Become Rich, Famous & Successful | Motivation | BeerBiceps Meditation",2018-03-15,423788,28880,1261,Mar
398,9 Easy Tips To Instantly Look Sexier In A Shirt For Men | BeerBiceps Men's Style,2018-03-12,2665183,79357,1764,Mar
399,5 Self Defense Techniques Every Women Should Know | BeerBiceps Women’s Fitness,2018-03-07,141504,7998,462,Mar
400,Fitness Rapid Fire QnA 🔥 | BeerBiceps Livestream 23,2018-03-05,37707,2171,168,Mar
401,Why Indian Education System Will F*CK UP Your Career & Life | BeerBiceps,2018-03-01,381474,26675,1874,Mar
402,4 SECRET Tips To Remove Dandruff Forever | BeerBiceps Health,2018-02-26,2417903,62630,1444,Feb
403,5 EASY Daily Habits THAT WILL CHANGE YOUR LIFE | Success Mentality | BeerBiceps Mental Fitness,2018-02-22,391234,23584,703,Feb
404,Top 5 Formal Clothing For Men | Office Dressing for Men | BeerBiceps Men's Fashion,2018-02-19,2020162,42822,1098,Feb
405,How To Maintain Weight & Stay Fit With PCOS - Women's Health | BeerBiceps Livestream 22,2018-02-15,27757,1233,125,Feb
406,Uncensored QnA Live Stream | BeerBiceps Livestream 21,2018-02-12,45864,2451,224,Feb
407,The Biggest Secret To Self Belief and Success | BeerBiceps Motivational Video,2018-02-08,251849,15209,876,Feb
408,5 Hair Product Side Effects - Honest Advice About HAIR Gels & Waxes | BeerBiceps Hair Care,2018-02-05,938901,36939,1570,Feb
409,Instantly Become More CONFIDENT In Life - 5 Step Confidence Boost | BeerBiceps Mental Fitness,2018-02-01,663216,43963,843,Feb
410,9 CRAZY T-Shirt Hacks - Instantly Look Sexier In A T-Shirt | BeerBiceps Men's Fashion,2018-01-29,2451061,61921,2211,Jan
411,Fitness Rapid Fire Q&A | BeerBiceps Livestream 20,2018-01-25,33778,2191,150,Jan
412,10 Best HAIR CARE Tips Ever - For Men | BeerBiceps,2018-01-22,2148787,57503,2124,Jan
413,Heartbreak? Watch This Video | BeerBiceps Break Up Motivation,2018-01-18,260727,15142,914,Jan
414,How To Get Fair Skin - The Secret Behind FAIRNESS | Grooming Tips For Dark Skin Men | BeerBiceps,2018-01-15,4183640,151930,3924,Jan
415,EASY Mental Trick To Study With Full Concentration & Focus | BeerBiceps Exam Motivation,2018-01-10,5306863,214708,5101,Jan
416,Top Fashion & Grooming Questions Answered - BeerBiceps Grooming | BeerBiceps Livestream 19,2018-01-08,43830,2235,169,Jan
417,The 1 Common Habit Of ALL Successful People - Priming Motivational Video | BeerBiceps,2018-01-03,658667,34685,930,Jan
418,6 MUST Have Jackets - Winter Jackets For Men In India | BeerBiceps Fashion,2018-01-01,628938,16250,784,Jan
419,5 Steps To Make THIS Year The Best Of Your Life | BeerBiceps Mental Health,2017-12-28,191136,15547,743,Dec
420,4 Party Looks - Dressing Rules | Be The HOTTEST Guy At The PARTY | BeerBiceps Party  Fashion,2017-12-25,1250594,29594,926,Dec
421,Top 10 Easy Tips To Achieve Happiness In Life | BeerBiceps Mental Fitness,2017-12-21,387098,19513,946,Dec
422,Dharavi Leather Market Tour & Guide - CHEAPEST But BEST Leather Market in ASIA | BeerBiceps,2017-12-18,252053,6052,250,Dec
423,Best Cheap & Honest Clothing Brand Recommendations | BeerBiceps Fashion,2017-12-12,871945,25997,933,Dec
424,ASK US ANYTHING | BeerBiceps Livestream 18,2017-12-11,30642,2100,168,Dec
425,10 Keto Myths That MOST PEOPLE Believe | Truth About Keto Diet | BeerBiceps Ketogenic Diet,2017-12-06,59920,2016,226,Dec
426,Best HAIRSTYLES For Indian Men ft. Knot Me Pretty | BeerBiceps,2017-12-04,1730355,44851,1214,Dec
